company_name,title,top_skills
"IDR, Inc.",Software Engineer 3,"organization, agile, communication"
"IDR, Inc.",Software Engineer BIDM,"sql, python, react, agile"
IGT,Software Engineer (Development),"c, sql, communication, problemsolving, programming, innovation"
INFY8,Software Engineer Architect (Java/Python),"programming, sql"
ITR Group,Software Engineer,"c, sql, agile, debugging, devops"
"ITS, LLC",Senior Specialist Software Engineer,"c, programming, testing, leadership, problemsolving, communication, teamwork"
ITW,Software Engineer,"communication, c, hardware, testing, debugging, innovation"
"Ideal Innovations, Inc.",Software Engineer,"hardware, testing"
InRhythm,React Software Engineer ,"innovation, express, javascript, agile, testing, communication"
InRhythm,Senior Software Engineer - Conversational AI / Chatbots,"go, innovation, programming, testing, express, automation, agile, communication"
Incident IQ,Senior Software Engineer,"c, writing, aspnet, testing, sql, programming, devops, debugging, problemsolving"
Included Health,"Senior Software Engineer, Customer Experience","leadership, collaboration"
Included Health,"Senior Software Engineer, Data Services","leadership, collaboration"
Included Health,"Staff Software Engineer, Cloud Platform","organization, agile, devops, collaboration"
Included Health,"Staff Software Engineer, Treat Team","automation, leadership, problemsolving, nosql, collaboration"
Info Way Solutions,Embedded Software Engineer,"c, debugging, cybersecurity, testing, innovation, writing, sql, programming"
Infobahn Softworld Inc,Senior Software Engineer (drivers developer),"programming, debugging"
Insight Global,ETL Data Software Engineer,hadoop
Insight Global,Flight Software Engineer,"hardware, c, programming, testing"
Insight Global,Junior Software Engineer,"communication, programming, sql"
Insight Global,Remote Java Software Engineer,"java, testing, spring"
Insight Global,Remote Software Engineer (Python),"docker, devops"
Insight Global,Software Engineer,"agile, organization, sql, writing, kubernetes, docker, programming, collaboration"
Insight Global,Software Engineer (Local to Michigan),
Integra Connect,Sr. Software Engineer- COBOL,"programming, testing, sql"
Internet2,Remote Sr Software Engineer - Infrastructure Systems & Software,"automation, testing, networking, leadership, planning, python, programming, organization"
Intuitive,Software Engineer - Manufacturing Surgical Robotics,"collaboration, testing, problemsolving, sql, communication"
Invisinet Technologies,Senior Software Engineer,"testing, leadership, collaboration, programming, networking, agile"
"J.B. Hunt Transport Services, Inc.","Software Engineer III, Sterling Integrator","agile, testing, programming, communication, java, c, html, angular, sql, nosql"
JAM Staffing,Embedded Software Engineer,"agile, programming"
JPMorgan Chase & Co.,AWS RDS Database Software Engineer II,"sql, agile, algorithms, programming, java, spring, testing, automation"
JPMorgan Chase & Co.,Python Software Engineer,"algorithms, programming, agile, spark, java"
JPMorgan Chase & Co.,Software Engineer,"innovation, planning, spring, agile, automation, sql, java"
JPMorgan Chase & Co.,Software Engineer II (Automation),"programming, agile, decisionmaking, testing, debugging"
JPMorgan Chase & Co.,Software Engineer III (Full Stack with React),"agile, algorithms, programming"
JPMorgan Chase & Co.,Software Engineer III - Java & AWS,"programming, agile, algorithms, spring, automation"
JPMorgan Chase & Co.,"Software Engineer III - Java, React, BI Tools and Data Pipeline Technologies","agile, algorithms, programming"
Jack in the Box,Sr Software Engineer ,"agile, writing, testing, programming, leadership"
Jacobs,Software Engineer Level 2- TS/SCI with Poly required,"programming, writing, java, presentation, spring, javascript, perl"
Jobot,Senior Software Engineer,"go, agile, kubernetes, spark, docker, typescript, problemsolving, communication"
Jobot,Software Engineer,"testing, c, scripting"
Jobot,Unreal Engine Software Engineer,"hardware, testing, programming"
Jobs via eFinancialCareers,C++ Algo Software Engineer - Chicago/New York- Leading Quant-Driven Market-Maker,"c, algorithms, python, innovation"
Joby Aviation,"Embedded Software Engineer, Flight Systems Infrastructure","hardware, c, writing, communication, python"
John Galt Staffing,JavaFX Software Engineer,java
"KBR, Inc.",Junior Full-Stack Software Engineer,"devops, organization, communication, programming, kubernetes"
"KBR, Inc.",Sr. Software Engineer,"flexibility, hardware, communication, cybersecurity, resilience, java"
KPG99 INC,Software Engineer (Outsystems),"sql, java, communication"
KPIT,Autosar Cybersecurity Software Engineer,"programming, communication, problemsolving"
KYYBA Inc,Software Engineer,
KYYBA Inc,Technical Software Engineer,"programming, testing, python, c"
Kapitus,Tech Lead\/Software Engineer III - Job ID: 552,"agile, testing, microservices, python, nosql, communication, interpersonal, problemsolving, motivation"
KellyMitchell Group,Senior Principal Software Engineer ,"angular, testing, debugging, agile"
Kiewit,Senior Software Engineer - Kiewit Technology Group,"planning, programming, sql, problemsolving, communication"
Kin Insurance,Principal Software Engineer - Data,"decisionmaking, leadership, organization"
Kinetic,Senior Staff Software Engineer,"python, automation, testing, django, nosql, problemsolving, communication"
Kinetix,Software Engineer 3,"leadership, agile, hardware, microservices, scripting, sql, programming"
Koddi,Junior Software Engineer - Cohort,"leadership, organization, communication, interpersonal, problemsolving"
LTK,"Software Engineer, Brand Platform","agile, writing, java, containerization, docker, communication"
Lacework,Software Engineer - Agent Backend Infrastructure,"algorithms, innovation, communication, python, nosql"
Lakera,Staff Software Engineer - AI Security,"devops, python"
Ledgent Technology,HVAC Controls Software Engineer,"automation, testing, networking, initiative"
Ledgent Technology,LabVIEW Software Engineer,"programming, c, problemsolving, interpersonal, communication, initiative"
Ledgent Technology,Software Engineer/SRE (Mandarin Experience Required),"kubernetes, programming, go, c, initiative"
Ledgent Technology,Systems Software Engineer II,"testing, automation, programming, hardware, leadership, initiative"
Leidos,Software Engineer,"agile, testing, devops, java, programming, scripting, algorithms, sql, nosql, leadership"
LemaTech LLC,Software Engineer,"programming, problemsolving, communication, teamwork"
LexisNexis Risk Solutions, Software Engineer - Proprietary languages,"testing, communication, flexibility, react"
LexisNexis Risk Solutions,"Senior Software Engineer II-Hybrid in Boca Raton, FL",
LexisNexis Risk Solutions,Software Engineer II,"testing, communication"
Lexmark,Software Engineer Intern - Summer 2024,
Liberty Mutual Insurance,Software Engineer / DevOps (Security) - Hybrid/Remote,"agile, devops, python, adaptability, programming"
Lighthouse,Principal Software Engineer,"devops, leadership, innovation, collaboration, initiative, organization, c"
LinkedIn,Senior Software Engineer - Applications,"python, programming, collaboration"
LinkedIn,"Staff Software Engineer, ML Foundations SRE ","go, innovation, programming, rust, communication"
Litera,Senior Software Engineer (Clojure),"communication, leadership, sql, testing"
"Lowe's Companies, Inc.",Senior Software Engineer,"testing, javascript, automation, spring, react, java, docker, programming, css, writing"
"Lowe's Companies, Inc.",Software Engineer,"testing, programming, javascript, spring, agile, react, java, jenkins, angular"
Lumen Resources,Senior Software Engineer Technical Lead,"problemsolving, adaptability, communication, interpersonal, writing"
M&T Bank,Software Engineer - ServiceNow,"leadership, organization, hardware, problemsolving, communication"
MDpanel,Senior Software Engineer - Backend (US-Remote),"programming, testing"
MIB,Senior Software Engineer,"automation, agile, programming, spring, organization, innovation, communication, java, react, testing"
MIla Health Inc,AI ML Software Engineer - Artificial Integence / Machine Learning ,"innovation, algorithms, programming, python, containerization, problemsolving, communication"
MUFG,Software Engineer Lead,"python, agile, programming, communication"
MVP Health Care,Software Engineer,"agile, planning, react, initiative, angular, devops"
Mach7 Technologies,Software Engineer in Test,"automation, testing, flexibility, jenkins, devops, c, programming, virtualization, containerization, docker"
Mach7 Technologies,Staff Software Engineer,"leadership, sql"
MacroHire,Back-End Software Engineer (Hybrid),"encryption, programming"
Magnit,Senior Software Engineer,"agile, java, javascript"
Mainspring Energy,Embedded Software Engineer,"hardware, programming"
Mainspring Energy,Senior Embedded Software Engineer,"hardware, programming, communication, testing"
Mainz Brady Group,Data Platform Senior Software Engineer,"go, programming, python, flexibility"
Mainz Brady Group,Data Platform Software Engineer,"go, programming, python, flexibility"
Mainz Brady Group,Senior Software Engineer,"devops, automation, javascript, collaboration, communication, agile"
Manticore Games Inc.,Senior/Principal Software Engineer - Gameplay (Remote),"planning, programming, communication, networking"
Markel,R0018037 Sr. Software Engineer,"agile, sql, hardware, programming, automation, devops, communication, organization, flexibility, initiative"
Marqeta,Senior Software Engineer - Kubernetes Platform Engineering team,"kubernetes, flexibility"
Marriott International,"Software Engineer-Senior, Corporate System HR & Payroll Applications","agile, leadership, programming, python"
Martin Marietta,Lead Software Engineer,"testing, sql, problemsolving, debugging, devops, writing, angular"
Mason Frank International,Software Engineer,
"Matson, Inc.",Senior Software Engineer,"spring, programming, communication, debugging, collaboration, java, react, sql"
Maxim Healthcare Staffing,Direct Support Personnel - SE 27th,"interpersonal, communication, organization"
Maxim Healthcare Staffing,Software Engineer II,"organization, c, sql, programming, scripting, communication"
McGriff,Software Engineer II--Workday API,"sql, testing, agile, programming, debugging"
McGriff,Software Engineer III--Workday API's,"sql, testing, agile, programming, debugging"
McGriff,Software Engineer-Frontend,"testing, agile, javascript, angular, programming, debugging"
Mercor,Software Engineer,"algorithms, c"
Meta,Software Engineer - Calibration Team,"c, debugging, python, pytorch"
Meta,"Software Engineer, Android","programming, java, kotlin, testing"
"Metasys Technologies, Inc.",Software Engineer in Test,"testing, automation, jenkins"
"Metis Technology Solutions, Inc.",Simulations Software Engineer,"java, writing, interpersonal, communication, agile"
Mezino Technologies,Senior Software Engineer,django
Michelin,Senior Software Engineer (Experienced Level Professional),"agile, devops, debugging, communication, writing"
Microsoft,Principal Software Engineer,"organization, testing, machinelearning, programming, javascript, nodejs, typescript, c"
Microsoft,Principle Software Engineer,"hardware, initiative, organization, scripting, python, collaboration, communication"
Microsoft,SAP Software Engineer II,"planning, innovation, microservices, automation, organization, agile"
Microsoft,Senior High Performance Computing (HPC) Software Engineer,"hardware, organization, communication"
Microsoft,Senior Software Engineer - Power Apps,"organization, innovation, agile, javascript, typescript"
Microsoft,Software Engineer,"communication, agile, innovation, organization, debugging, python, react, programming, problemsolving"
Microsoft,Software Engineer I/II,"debugging, agile, organization, c, problemsolving"
Microsoft,Software Engineer II,"organization, agile, planning, automation, networking, debugging, python, devops, innovation, microservices"
Microsoft,Software Engineer II – Azure Storage,"organization, programming, algorithms, debugging"
Mindlance,Java Software Engineer,"java, spring"
"Mission Technologies, a division of HII",NGTS VTTC Software Engineer Developer Jr. - 18702,"programming, c, python, collaboration, creativity"
"Mission Technologies, a division of HII",Software Engineer (Engineer Software 4) - 18587,"hardware, programming, organization"
"Mission Technologies, a division of HII","Software Engineer, Associate (Engineer Software 1) - 18662","hardware, programming, networking, communication, planning, organization"
"Mitsubishi Electric Power Products, Inc.",Senior Software Engineer,
ModMed,Senior Software Engineer - PHP,"agile, collaboration, innovation, debugging, php, programming, empathy, decisionmaking, initiative, laravel"
Mojang Studios,Senior Software Engineer on Minecraft,"c, organization, collaboration"
MongoDB,"Senior Software Engineer, Payments","innovation, testing, planning"
"Montage Technology, Inc",Validation Software Engineer - DDR5 Memory Systems,"algorithms, python, c, hardware, programming, problemsolving, communication, teamwork, testing"
Motion Recruitment,Lead Embedded Software Engineer (C++/Qt),"leadership, programming, hardware, c, communication, interpersonal"
Motion Recruitment,Principal Software Engineer,nodejs
Motion Recruitment,Qlik Sense Software Engineer,"sql, communication, flexibility, automation, writing"
Motion Recruitment,"REMOTE / Senior Software Engineer / C#, .NET, Vue.JS","sql, javascript"
Motion Recruitment,Senior Embedded Software Engineer (QT),"c, programming, hardware, agile, communication, leadership"
Motion Recruitment,Senior Java Software Engineer,"java, interpersonal, communication, spring, sql, microservices, python, kafka"
Motion Recruitment,Senior Software Engineer,"c, hardware, programming, agile, problemsolving, communication"
Motion Recruitment,Senior Software Engineer / C# and .NET / South Jersey,"sql, javascript"
Motion Recruitment,Senior Software Engineer / C# and .NET / Trading,"python, django, sql, writing"
Motion Recruitment,Software Engineer / Java / Remote,"java, c"
Motion Recruitment,Staff Software Engineer,"agile, collaboration, organization, typescript, python, algorithms"
Motion Recruitment,Staff Software Engineer / Golang,collaboration
Moveworks,"Sr. Software Engineer, Search Relevance","organization, automation"
NAVEX,Senior Lead Software Engineer,"planning, sql, testing, programming, agile, debugging, python, containerization, docker, communication"
NAVEX,Senior Staff Software Engineer,"agile, c, sql, innovation, communication"
NAVEX,Staff Software Engineer,"python, agile, sql, containerization, docker, innovation, communication"
NICE,Senior Software Engineer,"agile, automation, problemsolving, communication, decisionmaking, innovation"
NJF Global Holdings Ltd,C++ Software Engineer (Quant Trading),c
NLB Services,Software Engineer in Test,"automation, python, sql, agile, programming, scripting, testing, writing"
NMDP,Principal Software Engineer- Homebase,"testing, programming, debugging, agile, problemsolving, java, angular, automation"
NOVA® Home Loans,Software Engineer III,"programming, sql, leadership, debugging, scripting, agile"
NVIDIA,"Senior Software Engineer, AI Developer Tools - Cloud Software","innovation, hardware, docker, communication"
Narvar,Senior Software Engineer II (Ruby on Rails),"ruby, react, javascript"
National Association of Insurance Commissioners (NAIC),Software Engineer III,"organization, communication, flexibility, java, agile, react, sql, spring"
Nationwide,"Sr. Engineer, Software Engineer (ERisk Services - Flanders, NJ)","agile, programming, leadership"
Natsoft,Embedded Software Engineer ,"programming, c"
"Navitas Partners, LLC",Software Engineer in Test,"testing, automation"
Neighborly Software,Senior Full Stack Software Engineer,"agile, collaboration, programming, javascript"
NetJets,"Software Engineer, Associate (NJUS)","automation, testing, agile, collaboration, innovation, adaptability, programming, python, communication"
Netflix,iOS Software Engineer 4 - Consumer Engineering,
Next Ventures,Principal Software Engineer,"initiative, programming, agile, leadership"
NextCreator,SWE Intern,"programming, problemsolving, communication, collaboration"
"Niantic, Inc.",Software Engineer,"javascript, typescript, collaboration"
"Niantic, Inc.","Software Engineer, Machine Learning","automation, planning, programming, devops, communication, collaboration"
Northrop Grumman,Software Engineer / Principal Software Engineer,"automation, testing, python, scripting, leadership, containerization, devops, interpersonal, bash, agile"
Northrop Grumman,Software Engineer/Principal Software Engineer - Active DoD Secret Clearance Required,"agile, organization, communication, interpersonal, problemsolving, teamwork"
Northrop Grumman,Staff Software Engineer (AHT),"collaboration, agile"
Not applicable1,Senior Software Engineer,"nodejs, java"
Nutrien,Sr Software Engineer,"initiative, leadership, writing, agile"
Nuvolant,Software Engineer,"programming, problemsolving, agile"
Nyla Technology Solutions,Senior Software Engineer,"writing, agile, devops, testing"
OSI Engineering,Dataplane Software Engineer (SASE),"programming, virtualization, debugging, writing, python, scripting, networking"
OSI Engineering,"Infrastructure Software Engineer for 3+ month contract at Global Device Company in Cupertino, CA","kubernetes, organization, communication, hadoop, scripting"
OSI Engineering,"Software Engineer for global computer software company in Redmond, WA.","automation, problemsolving, communication, containerization, docker, devops"
OSI Engineering,"Staff Software Engineer for a well-known personal finance management company in Menlo Park, CA","java, testing, spring, programming, collaboration"
Obsidian Security,Senior Software Engineer - LLM services,"cybersecurity, collaboration, python, problemsolving, leadership, communication"
Ocean Technology inc,Embedded Software Engineer,
OhioHealth,Physical Therapist Home Health - SE Central Ohio,communication
Okta,Software Engineer- Federal,"automation, problemsolving, scripting, testing, leadership, organization, flexibility"
Oloop Technology Solutions,Senior Java Software Engineer,"microservices, automation"
Omega Holdings,Software Engineer,"automation, sql, python, programming"
Onward Search,Freelance Principal Software Engineer [74452],"innovation, spring, agile, kafka, nosql, containerization"
Open Systems Technologies,Full Stack Software Engineer,
Open Systems Technologies,Java Software Engineer,java
Open Systems Technologies,Senior Software Engineer - Data Analytics,
Open Systems Technologies,Software Engineer,"nodejs, kafka"
OpenGov Inc.,Sr. Software Engineer,"agile, microservices, leadership, collaboration, devops, automation, innovation, programming, javascript, sql"
Optum,Lead Cloud Software Engineer,"organization, leadership, agile, flexibility, programming, automation"
Oracle,Principal Software Engineer,"devops, innovation, spark, organization, agile, problemsolving, communication, flexibility, planning, go"
Oracle,Principal Software Engineer (C++),"c, sql, programming, problemsolving, debugging, communication, planning"
Oracle,Principal Software Engineer (Network File System),"testing, networking"
Oracle,Senior Software Engineer,"programming, problemsolving, communication, debugging"
Oracle,Software Engineer,"agile, communication, nosql, hadoop, planning, innovation, go"
Origin AI,Embedded Software Engineer,"communication, problemsolving, algorithms, networking, hardware"
"Outcome Logix ( A Tech 50 Finalist company 2022, by Pittsburgh Technology Council )",Workday Integration Software Engineer - Remote - Direct Client_JOBID307,testing
PKWARE,"Principal Software Engineer, Large Platform","testing, agile, communication"
PLANSIGHT,Software Engineer,"php, bootstrap, agile, communication, teamwork, laravel"
PMG GLOBAL,Software Engineer in Test,"testing, sql, automation, communication, java, programming"
PRI Technology,Senior Java Software Engineer,"java, spring, sql"
PRI Technology,Senior Software Engineer,"spring, sql"
Palantir Technologies,Backend Software Engineer - Infrastructure,"go, organization, programming, communication, planning"
Palo Alto Networks,Principal Software Engineer (AI Security Cloud),"cybersecurity, flexibility, collaboration, innovation, programming"
Palo Alto Networks,Principal Software Engineer (AI Security),"cybersecurity, flexibility, collaboration, innovation, programming"
Palo Alto Networks,Principal Software Engineer (Cloud Native NMS),"cybersecurity, leadership, collaboration, devops, programming, python, kubernetes"
Palo Alto Networks,Principal Software Engineer - Backend - Python (Xpanse),"cybersecurity, flexibility, collaboration, innovation, java"
Palo Alto Networks,Senior Staff Software Engineer (Front End - UI Focus),"cybersecurity, flexibility, collaboration, innovation, java, angular, nosql, testing"
Palo Alto Networks,Sr Principal Software Engineer (L7 Data Plane),"cybersecurity, collaboration, flexibility, innovation, teamwork, devops, programming, communication"
Panacea Direct Inc,Software Engineer,react
Panacea Direct Inc,Sr Software Engineer (Cobol),"agile, communication"
Parallel,Senior Software Engineer,"innovation, react, programming"
Paramount,Senior Director Software Engineer - Advanced Advertising,"innovation, agile, interpersonal, programming"
"Paramount Software Solutions, Inc","Software Engineer (architecture, development )","planning, testing, programming, agile, nodejs, communication"
Parsons Corporation,Software Engineer / Research Scientist,"pytorch, tensorflow"
Paycor,Senior Software Engineer,"agile, testing, innovation, writing, c, nosql"
Peacock,"Senior Software Engineer, Peacock, Direct-to-Consumer","microservices, go, kafka"
Pegasystems,Senior Software Engineer,"agile, java, algorithms, leadership"
People Tech Group Inc,Software Engineer,"programming, problemsolving, planning"
Peraton,Junior Software Engineer,"agile, sql"
Physicians Mutual,Sr Software Engineer Distributed Systems,"spring, java, agile, kafka, angular, writing, problemsolving, jenkins"
Pinnacle,"Principal Software Engineer, Python","devops, python, sql, algorithms, agile, debugging, collaboration, communication, interpersonal, c"
Pinterest,"Staff Software Engineer, ML Serving Platform","hardware, python"
Pipio,Software Engineer - Video and Audio Editor,"communication, nodejs, typescript, angular, nosql, html"
Pluralsight,Software Engineer,"writing, agile, collaboration, python, creativity"
Premier Group Recruitment,Software Engineer,"programming, python"
Premise,"Sr. Software Engineer, Infrastructure","organization, agile, programming, scripting"
Prestige Staffing,Senior Software Engineer,"spring, microservices, java, communication"
PriceSenz,Embedded Software Engineer,"programming, scripting"
PriceSenz,Sr./Staff  WiFi MAC Software Engineer ,"c, programming, problemsolving, communication"
Principal Financial Group,Experienced Software Engineer (Salesforce),automation
PrismHR,Senior Software Engineer,"kubernetes, writing, react, testing, ruby, angular, docker, kafka"
Pro17Analytics,Senior Software Engineer - Oracle PL/SQL,"agile, writing, programming, testing, java"
Procore Technologies,"Senior Software Engineer, Backend","organization, flexibility, teamwork, react, testing"
Procore Technologies,"Software Engineer 1, Backend",organization
Procore Technologies,"Software Engineer II, Ruby","kubernetes, java"
Procore Technologies,Staff Software Engineer,"devops, leadership, agile"
Procore Technologies,"Staff Software Engineer, Backend (Ruby)","kubernetes, java"
Procore Technologies,"Staff Software Engineer, Backend (Software Delivery)","collaboration, java"
Procore Technologies,"Staff Software Engineer, Full-Stack (Ruby)","typescript, react, ruby"
Prodigy Resources,Embedded Software Engineer,"adaptability, collaboration, interpersonal, testing, debugging, hardware"
Protingent,Telecommunications Software Engineer,"communication, testing, programming, hardware"
Provision People,Python Software Engineer,"python, programming, sql"
Publicis Media,Lead Software Engineer,"python, devops, innovation, agile, writing, debugging, programming, leadership, flexibility, go"
Publix Super Markets,Lead Software Engineer – Pharmacy Core Platform,"leadership, ansible, kafka, collaboration, teamwork, java, sql, scripting, spring, kubernetes"
Publix Super Markets,Sr. Software Engineer- Warehousing Modernization,"leadership, testing, motivation, sql, docker, agile, devops, angular, python"
Qentelli,Software Engineer in Test Automation,"automation, sql, problemsolving, c, jenkins, programming, java, python, agile, communication"
"Qorvo, Inc.",Software Engineer - Sensors and Prototyping,"testing, problemsolving, communication, collaboration"
Qualcomm,Graphics Software Engineer,"programming, decisionmaking, communication"
QueryPal,FE/Fullstack Software Engineer,"communication, automation, problemsolving, react, python, go, flexibility, algorithms"
"Quest Analytics, LLC","Software Engineer, Lead","testing, go, algorithms, programming, c, sql, javascript, react, flexibility, innovation"
Qumulo,"Software Engineer, Core Data Services","testing, programming, java, communication, debugging"
RCG Infosoft Incorporation,Senior Software Engineer,"java, kafka, go, python, writing, testing, leadership"
REN-ISAC,Software Engineer,"cybersecurity, organization, python, ruby, testing, programming"
RGBSI,Senior Software Engineer,"programming, automation, sql, communication, problemsolving, java, react"
"RIVA Solutions, Inc.",Senior Software Engineer,"containerization, typescript, angular, nodejs, problemsolving, communication, collaboration"
RVCM (RevaComm),"Software Engineer IV, Tech Lead","agile, spring, c, programming, leadership, organization"
