company_name,title,top_skills
Compunnel Inc.,Senior Software Engineer,"spring, docker, leadership, organization, kubernetes, agile, kafka, terraform"
Compunnel Inc.,Software Engineer in Test (Cypress),"automation, javascript, agile, python, testing, java, jenkins"
Compunnel Inc.,Sr Software Engineer,"angular, automation, c, python, sql, networking, devops, docker"
"Comscore, Inc.",Software Engineer,communication
Confidential,Principal Software Engineer,"writing, agile"
Confidential,Senior C++ Software Engineer (Medical Devices) - No Visa - Onsite,"c, interpersonal, agile, debugging, hardware, scripting, communication"
Confidential,Senior Software Engineer,
Connect-IT ,Senior Software Engineer,"python, programming"
Constellation,Software Engineer (Remote),"testing, sql, programming, agile, debugging, problemsolving, teamwork, nosql, initiative, negotiation"
Conveyor,"Junior Software Engineer, AI","algorithms, programming, problemsolving, innovation"
Cookonnect,Senior Software Engineer,"ruby, testing, programming, planning, collaboration, agile, communication, writing, flexibility, leadership"
"Core Techs, Inc",Senior Software Engineer,"react, writing, communication, programming, devops, sql, automation"
Cornelis Networks,"Sr. Software Engineer, OPX (Libfabric Provider)","hardware, writing, express, communication, programming, agile"
CornerUp,Senior Backend Software Engineer,"leadership, microservices, react, devops, problemsolving"
Corps Team,Software Engineer (.NET/C#),"problemsolving, communication, agile, sql, devops"
Costco Wholesale,Software Engineer - Booking - Costco Travel,"sql, java, testing, automation, communication, planning, react, problemsolving, javascript"
Cotiviti,Associate Software Engineer,communication
Cotiviti,Software Engineer,"sql, aspnet, programming, java, testing, javascript, microservices, scripting, python, interpersonal"
Covetrus,Software Engineer,"javascript, react, programming, java, spring, nodejs, sql, agile"
Cox Automotive Inc.,Software Engineer I,"agile, organization, ruby, typescript, ansible, creativity, flexibility, innovation, planning"
Crestron Electronics,"Software Engineer, Intelligent Video","algorithms, planning, programming, c, java, networking, scripting, communication, agile"
Crew Capital,Senior Software Engineer,"typescript, nodejs, empathy, planning, organization, leadership"
CrowdStrike,Software Engineer – Streaming Search (Remote),"c, python, writing, scripting, automation, ruby, go, java, kafka, cybersecurity"
CrowdStrike,Sr. Software Engineer - Android (Remote),"innovation, collaboration, cybersecurity, flexibility, testing, java, react"
CrowdStrike,Sr. Software Engineer - Cloud (Remote),"innovation, communication, cybersecurity, flexibility, kubernetes, algorithms, programming, go, nodejs, testing"
CrowdStrike,Sr. Software Engineer - macOS Sensor (Remote),"innovation, cybersecurity, flexibility, python, collaboration"
Crunchyroll,"Staff Software Engineer, Partner Engineering","collaboration, testing, html, react"
Crypto Recruiters,Senior Software Engineer / Python / DeFi,"python, communication, problemsolving"
Curinos,Senior Software Engineer - Data Platforms,"writing, agile, sql, communication, networking, go"
Curinos,Senior Software Engineer - Data Platforms (US),"writing, agile, sql, communication, networking, go"
"Curtis Instruments, A Kohler Co.",Embedded Software Engineer,"communication, flexibility, testing, debugging, interpersonal"
Cypress HCM,"Senior Software Engineer, 32707699","scripting, communication"
D. E. Shaw Research,"Software Engineer, Data Infrastructure at D. E. Shaw Research","python, programming, writing"
DAT Freight & Analytics,Staff Software Engineer,"kafka, innovation, microservices, sql, nosql, leadership, communication, javascript, docker, react"
DICE (EA Digital Illusions CE AB),Software Engineer,"scripting, debugging, express, react, collaboration, programming, writing, communication, creativity"
Daikin Comfort,Embedded Software Engineer,"communication, testing, algorithms, programming, networking"
Daikin Comfort,Test Controls Software Engineer,"testing, scripting, debugging, automation, programming"
DataAnnotation,Software Engineer,"programming, c, flexibility, writing"
Dataminr,"Principal Software Engineer, Knowledge and AI","programming, leadership"
Dataquad Inc.,Senior Java Software Engineer,"java, go, angular, leadership"
DeepScribe,Lead Software Engineer - ML Infrastructure,
Delta Infotek,Senior Software Engineer,"scripting, communication, leadership, c, automation, agile"
"Denken Solutions, Inc.",Senior Java Software Engineer - W2 Position (Global Banking),"agile, nosql, programming"
Design Pickle,Senior Software Engineer (Front End),"communication, collaboration, ruby, programming, javascript, react, agile, leadership, spark"
Destiny (D/XYZ),Senior Software Engineer,"writing, programming, problemsolving, communication"
Dexian,Sr. Software Engineer/API Developer,"agile, testing"
Dexian India,Senior Java Software Engineer,"kafka, spring"
Dice,"Android Software Engineer, Core and Monetization","testing, kotlin, writing, collaboration, communication"
Dice,Backend Java Senior Software Engineer Developer,"problemsolving, java, spring, python, typescript, innovation, testing"
Dice,Cloud Software Engineer,"programming, agile, sql, nosql, java, spring, writing, testing, communication, teamwork"
Dice,IBM Tivoli Software Engineer,"automation, programming, problemsolving, interpersonal, containerization, virtualization"
Dice,Northrop Grumman (DoD SkillBridge) - Cyber Software Engineer - Cincinnati OH,"programming, networking, organization, leadership, collaboration, communication, scripting, debugging, agile"
Dice,Principal Software Engineer (Springboot / Fintech),"java, spring, problemsolving, communication"
Dice,Principal Software Engineer - Front End Developer,"testing, innovation, angular, organization"
Dice,"Principal Software Engineer, Software Hardware Controls","hardware, c"
Dice,"SRE / Software Engineer (Kubernetes, AWS)","spark, kubernetes, networking, programming, automation, scripting, python"
Dice,Senior Software Engineer,"testing, communication, innovation, writing, programming, microservices, automation, sql, spring, rust"
Dice,Software Engineer,"programming, sql, spring, problemsolving, communication, interpersonal, innovation"
Dice,Software Engineer (Full Stack),"spring, java, microservices, agile, problemsolving, nodejs, docker, kubernetes, containerization"
Dice,Software Engineer .NET (Banking),"sql, c, devops, problemsolving, communication, leadership, collaboration, creativity, python, r"
Dice,Sr Principal Cyber Software Engineer (EC),"algorithms, hardware, agile"
Digital Prospectors,Senior Software Engineer,"agile, c, programming, debugging, hardware, scripting"
Digital.ai,Software Engineer,"testing, agile, c, communication"
Diverse Lynx,Senior Java Software Engineer (10+ years) (Fulltime),"writing, java, spring, angular, agile, microservices, communication"
Divorce.com,Software Engineer (Backend),"python, ruby, innovation"
Docusign,Software Engineer,"c, testing, nosql, writing, communication, programming, spark, sql"
Docusign,"Software Engineer, CLM Platform","agile, c, programming, html, problemsolving"
DoorDash,"Software Engineer II, iOS","empathy, go, innovation, initiative"
Drake Software,Principal Software Engineer,aspnet
Draper,Embedded Software Engineer,"innovation, communication"
Dropbox,Infrastructure Software Engineer,"debugging, python"
Dropbox,"Principal Software Engineer, Product Platform",
Duetto,Senior/Lead Software Engineer,"java, javascript, sql, nosql, spring"
"Dynalab, Inc.",Senior Software Engineer,"flexibility, c, hardware"
E-Solutions,Embedded Software Engineer,"c, programming"
ECS,Junior AI/ML Software Engineer,"agile, writing, automation, devops, collaboration, interpersonal"
ENGIE Impact,Software Engineer,"react, communication, agile, testing, typescript"
EPITEC,Software Engineer,"python, agile, docker, communication, listening, programming, react, devops, presentation, java"
EVONA,Embedded Software Engineer,"hardware, c"
EVONA,Flight Software Engineer,"hardware, c"
EVONA,"Mission Operations, Software Engineer",c
EVONA,Software Engineer,"hardware, c"
EVONA,Staff Software Engineer - Ground Software,"testing, communication, writing, kubernetes"
"EXB Solutions, Inc",Software Engineer- Displays,"c, programming"
Early Warning®,Sr. Software Engineer - Test (SDET) - Paze,"automation, testing, planning, innovation, programming, nodejs, java, networking"
EarnIn,Staff Software Engineer,"flexibility, leadership, communication"
Earth Robotics,Full Stack Software Engineer,"communication, sql, programming, php, problemsolving"
Echo Global Logistics,Staff Software Engineer,"agile, planning, automation, communication"
Ecolab,Software Engineer (Microsoft Dynamics 365),"organization, testing, programming, problemsolving, communication, interpersonal, initiative"
Edison Smart,Wireless Embedded Software Engineer,networking
EglobeData,Software Engineer in Test,"testing, automation, sql, html, programming, decisionmaking, jenkins, communication, python, writing"
Ehub Global Inc,Software Engineer,"aspnet, sql"
"Elegant Enterprise-Wide Solutions, Inc.", Embedded Sensor/EW Real-Time Software Engineer,communication
"Elegant Enterprise-Wide Solutions, Inc.",Embedded Real-Time Software Engineer,
"Elegant Enterprise-Wide Solutions, Inc.",Senior Software Engineer,"programming, agile, algorithms, debugging, hardware, communication, networking, testing"
"Elegant Enterprise-Wide Solutions, Inc.",Software Engineer,"communication, networking, testing, agile"
Eleos Labs,Software Engineer Intern,"encryption, agile, planning, devops, sql, testing"
Eliassen Group,Senior Software Engineer (Node.js/AWS),"scripting, agile, testing"
Eliassen Group,Sr. Software Engineer,"innovation, programming"
EnerSys,Senior Embedded Software Engineer,"testing, hardware, scripting, leadership"
Entegee,Embedded Software Engineer,flexibility
Entegee,Software Engineer,"flexibility, react, c, testing, nodejs, javascript, css, html"
Epiroc,Software Engineer,"testing, communication, innovation"
Equifax,Senior Software Engineer,"communication, leadership, microservices, jenkins, terraform, presentation, go, agile, css, angular"
Equifax,Senior Software Engineer - MFT,"microservices, jenkins, terraform, angular, agile, sql"
Equifax,Software Engineer,"agile, microservices, javascript, programming, css, sql"
Equity Residential,Software Engineer,"writing, organization, collaboration, programming, sql, devops, communication"
Esri,Sr. C++ Software Engineer - Maps SDKs,"c, algorithms, communication"
"Everest Consultants, Inc.",Sr. Software Engineer - (Full Stack),"testing, nosql, java, react"
Evinova,Software Engineer – Evinova,"spring, devops, nosql, angular, typescript, problemsolving"
Exact Sciences,Senior Software Engineer,"creativity, testing, sql"
Exarca Inc.,Storage Software Engineer with Infrastructure,"java, scripting, python"
Execufy,Senior Software Engineer,"programming, leadership, initiative, innovation, agile, communication, interpersonal, networking"
Experis,Agile Software Engineer (Java/Scala) (Jersey City),"agile, programming, writing, problemsolving, scripting"
Experis,Front End Software Engineer,"testing, programming, angular, sql, nosql"
Experis,Senior Software Engineer - Android,"agile, communication, go, testing"
Experis,Software Engineer,"communication, innovation, debugging, scripting, bash"
Experis,Software Engineer – Full Stack,"testing, agile, initiative, programming, automation, devops"
FIS,Software Engineer Front-End (Platforms Team),"agile, typescript, testing, communication, collaboration"
FIS,Software Engineer I,"automation, sql, devops, innovation, microservices, agile, testing, debugging, jenkins, ansible"
FIS,Software Engineer Senior,"communication, collaboration, python, kubernetes"
FIS,Software Engineer Specialist - COBOL (MICROFOCUS),"programming, testing, innovation, debugging, teamwork, java, communication"
"FUJIFILM Sonosite, Inc.",Senior Software Engineer,"communication, debugging, c, innovation, go, hardware, programming, writing, ruby"
FUSTIS LLC,Lead Python Software Engineer,"python, microservices, programming"
FYI Solutions,Lead Software Engineer,"java, communication, agile, programming, teamwork, leadership, innovation, javascript, nodejs, collaboration"
FanDuel,Senior Software Engineer - Fraud Tooling,"testing, java, terraform, writing, programming, devops"
FanDuel,Software Engineer - Fraud,"java, testing, terraform, innovation, hardware, writing, programming, react, agile"
Fanatics,"Software Engineer II, Front End (React)",organization
Fanatics,"Sr. Staff Software Engineer, Back End","organization, leadership, programming, c, nosql, problemsolving"
Fanatics,Staff Software Engineer (SDET),"testing, automation, agile, organization"
FastTek Global,Software Engineer Senior,"agile, go, testing, communication, sql, interpersonal"
Favor Delivery,Senior Software Engineer - Back End,"communication, planning, algorithms, go"
Fetch,iOS Software Engineer,"planning, swift, testing, hardware"
Fidelity Investments,Principal Software Engineer,"java, collaboration, leadership, go, agile, angular, spring, sql"
Fidelity Investments,Python- Data Analytics -Senior Software Engineer,"go, organization, python, programming, testing, devops, automation, jenkins, writing, problemsolving"
Fidelity Investments,Senior Software Engineer Test,"automation, agile, organization, go, programming, java"
Fidelity Investments,Senior Software Engineer-(Mainframe/ SQL/ ETL),"go, organization, debugging, testing, agile, communication"
Fifth Third Bank,Float Personal Banker 1 - Toledo SE Region,leadership
Fifth Third Bank,Senior Software Engineer,"agile, sql, spring, networking, problemsolving"
First Cloud Inc,Java Software Engineer ( Only Visa Indepedent),java
FiscalNote,Senior Software Engineer,"leadership, python, collaboration, decisionmaking, writing, flexibility"
Fivetran,Senior Staff Software Engineer,"sql, react, kubernetes, debugging, leadership, programming, java"
Flaunt,Senior Software Engineer,"writing, typescript, nextjs, communication, collaboration, innovation"
Flexton Inc.,Machine Learning Software Engineer,"algorithms, spark"
FloQast,Full Stack Senior Software Engineer - Close,"listening, automation, collaboration"
Ford Motor Company,Back-End Software Engineer - GCP,"spring, automation, devops, agile, jenkins"
Ford Motor Company,Cloud Software Engineer,"programming, agile, sql, nosql, java, spring, writing, testing, communication, teamwork"
Ford Motor Company,Full Stack Software Engineer - API Platform,"programming, microservices, testing, sql, nosql, agile, problemsolving, communication, teamwork, interpersonal"
Ford Motor Company,Senior Security Software Engineer,"organization, programming, collaboration, java, testing, problemsolving, communication, interpersonal"
Ford Motor Company,Senior Software Engineer-GCP,"planning, agile, spring, problemsolving, communication, teamwork"
Ford Motor Company,"Skilled Trade - Stationary Steam Engineer - SE MI Locations - Dearborn, MI",
Ford Motor Company,Software Engineer,"agile, java, spring, python, angular, react, programming, problemsolving, testing, docker"
Ford Motor Company,Software Engineer - Supply Chain,"agile, planning, leadership, java, sql, terraform, scripting, automation, communication"
Formation Bio,"Senior Software Engineer, Backend","innovation, collaboration, communication"
Foundation Model Startup,Senior Software Engineer,devops
Frankenmuth Insurance,Property Field Adjuster (SE MI),leadership
Freddie Mac,"Financial Model Software Engineer, Professional (Hybrid - 3 Days in Office)","c, testing, programming, collaboration, python"
Frontall USA,Software Engineer,hardware
FrostyWhale,Software Engineer,java
Fruition IT,Senior Software Engineer - Governance,"agile, automation, programming, terraform"
Fullsteam,Software Engineer,"testing, communication, hardware, problemsolving, react, sql, decisionmaking, networking, programming, debugging"
Fullstory,"Software Engineer, Data Engine","writing, kubernetes, listening, flexibility"
Function Health,Staff Software Engineer,"leadership, innovation, collaboration, problemsolving, containerization, react, programming, agile, python, initiative"
GE Aerospace,Embedded Software Engineer,"planning, communication, hardware"
GE HealthCare,Staff Software Engineer,"agile, leadership, testing, communication, organization, writing, algorithms, planning, c, java"
GHX,Sr. Software Engineer - .NET Content Dev,"typescript, javascript, testing, agile, flexibility, automation"
GOYT,Software Engineer,"php, decisionmaking, programming, communication, collaboration, innovation"
GRAIL,"Senior Software Engineer, Test #3748","testing, automation, writing, debugging, python, agile, listening, communication"
Galactic Minds INC,Embedded Software Engineer,"c, programming"
Garmin,DevOps Senior Software Engineer,"devops, automation, testing, python, scripting, jenkins, virtualization, ansible, c"
Gem,Software Engineer,organization
Gemini,"Software Engineer, Consumer Experience (Frontend)","collaboration, devops"
General Dynamics Mission Systems,Cybersecurity Software Engineer,"cybersecurity, agile, c, python, docker, testing, java, containerization, problemsolving, networking"
General Dynamics Mission Systems,Software Engineer,"testing, agile, c, java, leadership, innovation"
General Motors,Motorsports Junior Software Engineer,"programming, testing, sql, organization, innovation, angular, css, problemsolving, flexibility"
General Motors,Senior Software Engineer - Cloud Platform,"networking, programming, python, kubernetes, communication, problemsolving, flexibility, organization, go"
General Motors,Sr. Software Engineer,"sql, devops, testing, containerization, docker, kubernetes, problemsolving, communication, flexibility"
General Motors,Staff Software Engineer,"programming, leadership, writing, presentation, flexibility"
General Motors,Staff Software Engineer - Cloud Platform,"organization, leadership, flexibility, networking, programming, python, kubernetes, communication, problemsolving, testing"
General Motors,Staff Software Engineer - Customer Account Management,"leadership, communication, organization, programming, java, angular, react, writing, presentation, flexibility"
General Motors,Staff Software Engineer - Customer Identity,"leadership, communication, organization, programming, spring, writing, presentation, flexibility"
Genesys,Senior Software Engineer,"collaboration, microservices, automation, testing, empathy, nosql, nodejs"
Genisis Technology Solutions,Java Software Engineer,"devops, docker, react, spring, agile"
Genius Sports,Senior Software Engineer - Video,"writing, innovation, planning, communication, programming, organization"
Georgia Tech Research Institute,Embedded Sensor/EW Real-Time Software Engineer - ATAS - Open Rank,"hardware, programming, problemsolving, algorithms, organization, leadership, communication"
Georgia Tech Research Institute,"Software Engineer - ELSYS - On Site - Warner Robins, GA - (Open Rank)","programming, hardware, testing, problemsolving, algorithms, debugging"
GfK - An NIQ Company,Lead Software Engineer (MRI-Simmons),"spring, agile, java, interpersonal, testing, leadership, angular, sql, communication, devops"
GitHub,"Senior Software Engineer, Edge (Infra)","communication, programming, leadership"
GitHub,Software Engineer III,"communication, ruby, organization, leadership"
Goldman Lloyds,Trading Software Engineer,java
Goldman Sachs,"Senior Software Engineer, Corporate Treasury, GS Bank Engineering","programming, leadership, innovation, spring, kubernetes, planning, problemsolving, communication, python, kafka"
Goldman Sachs,"Senior Software Engineer, VP - Microsoft Power Platform (Jersey City, NJ)",
Goldman Sachs,Software Engineer,
Goliath Partners,Senior Software Engineer,"python, c"
Goliath Partners,Software Engineer,"python, c, algorithms"
Google,"Senior Software Engineer, Embedded Systems/Firmware, Pixel","leadership, programming, networking, hardware"
Google,"Senior Software Engineer, Google Ads","leadership, programming, networking"
Google,"Senior Software Engineer, Infrastructure, Google Cloud Data Management","leadership, programming, hardware, networking"
Google,"Senior Software Engineer, Project Starline","leadership, programming, networking, hardware"
Google,"Senior Staff Software Engineer, Google Cloud, Looker","leadership, java, organization, sql, networking"
Google,"Senior Staff Software Engineer, Workload Identity Management","leadership, organization, networking"
Google,"Software Engineer III, Hardware/Software Co-Design","hardware, networking, python, programming, leadership"
Google,"Software Engineer III, Infrastructure, Google Cloud Platforms","programming, algorithms, hardware, networking, leadership"
Google,"Software Engineer III, Platforms Infrastructure Engineering","programming, algorithms, networking, leadership"
Google,"Staff Software Engineer, Borglet","networking, hardware, leadership, organization, planning"
Google,"Staff Software Engineer, Google Cloud Platforms","leadership, organization, networking"
Google,"Staff Software Engineer, Infrastructure, Search","leadership, hardware, organization, networking"
Google,"Staff Software Engineer, Pixel GPU System Software","leadership, organization, networking, hardware"
Goosehead Insurance Agency,Senior Software Engineer,"nodejs, react, initiative, decisionmaking, interpersonal, communication, problemsolving"
GraceMark Solutions,Cloud Application Software Engineer,"testing, programming, microservices, kubernetes, kafka"
GraceMark Solutions,Cloud software Engineer,"programming, microservices, kubernetes"
Grammarly,"Software Engineer, Back-End","collaboration, writing, java, algorithms, debugging"
Grammarly,"Software Engineer, Front-End","collaboration, writing, react, typescript, algorithms, javascript, testing, programming"
Grammarly,"Software Engineer, Quality tools","collaboration, writing, python"
Gridavate,Senior Software Engineer,"agile, planning, problemsolving, go, c, communication, teamwork"
"Griffin Global Systems, Inc.",Embedded Software Engineer,"hardware, c, communication"
"Groundswell, Inc.",SE Community Resilience Program Manager,"resilience, initiative, planning, collaboration, teamwork, communication"
H-E-B,Sr Software Engineer - Salesforce and React,"leadership, communication, java, agile"
H10 Capital,Display Software Engineer (16939),"hardware, programming, python, communication, debugging"
H10 Capital,Embedded Software Engineer,"hardware, automation, testing, python, programming"
HIRECLOUT,Frontend Software Engineer (Contract) (Hybrid) – 4315,"programming, nodejs, css, bootstrap, agile, sql, writing, testing, problemsolving, communication"
HIRECLOUT,Senior Back-end Software Engineer (Contract) (Hybrid) – 4314,"agile, writing, python, sql, microservices, testing, problemsolving, communication, planning, interpersonal"
HTC Global Services,Software Engineer - AWS - Senior,"communication, problemsolving, nosql, agile, collaboration"
HTC Global Services,Software Engineer - MS Power Platform - Senior,"automation, problemsolving, debugging"
HTC Global Services,Software Engineer - Senior,"agile, programming, leadership, communication, java, spring, testing"
HTC Global Services,Software Engineer Senior,"java, spring, nosql, communication"
"HTI Cybernetics, Inc.",Senior Control Software Engineer,"automation, programming"
Hadrian,Backend Software Engineer,
"Hanker Systems, Inc.",Software Engineer,"programming, python, hardware, communication"
Harness,Staff Software Engineer - UI,"innovation, devops, html, docker, testing, css, leadership, debugging, nodejs"
Harvey Nash,Software Engineer,"programming, encryption, communication"
Hearth AI,Senior Software Engineer,"algorithms, innovation, typescript"
Hedgehog,"Hardcore Dataplane Software Engineer. If you think like a packet, this job is for you!","networking, programming, testing, kubernetes, debugging"
Helix Tech IT Services,Software Engineer,"programming, communication, collaboration"
Heritage Grocers Group,Senior Software Engineer,"testing, sql, agile, problemsolving"
Higher Ground LLC,Senior Software Engineer,"programming, agile, django, docker"
Highwire,Software Engineer,"agile, java, c, php, go"
Hire Quality Recruiting,Senior Java Software Engineer,"java, flexibility"
Hirexa Solutions,Java Software Engineer,"spring, java, kubernetes, sql, writing, agile, terraform"
Hirexa Solutions,Mainframe/COBOL Software Engineer,"agile, initiative"
Honeycomb Software,MS Power Apps/Dynamics Software Engineer,"sql, javascript, problemsolving, communication, collaboration, decisionmaking"
Honeywell,Advanced Software Engineer,"organization, interpersonal, communication, leadership"
Honeywell,Software Engineer I - C++/Avionics,"innovation, communication"
Honeywell,Sr Embedded Software Engineer,"algorithms, hardware"
Honeywell,Sr Software Engineer - Synthetic Vision - 10K Sign on Bonus,"innovation, algorithms, decisionmaking, agile, collaboration"
Horizontal Talent,Software Engineer,java
HubSpot,"Software Engineer, Automation & Tooling","nodejs, django, organization"
Huntress,"Senior Software Engineer, PHP","php, agile, laravel, cybersecurity, programming, writing"
Huxley,Principal Software Engineer (Python),
HyperThinkUS,Senior Software Engineer,"c, networking, programming, problemsolving, communication, collaboration"
Hyqoo ,Sr Software Engineer - Infrastructure,"kubernetes, communication, programming, go, problemsolving, teamwork"
Hyster-Yale Group,Network Software Engineer,"testing, leadership, programming, hardware"
ICE,"Senior Software Engineer, Machine Learning","programming, python, spark, nosql, communication, flexibility"
"IDR, Inc.",Salesforce Software Engineer,"programming, jenkins, devops, organization"
