company_name,top_skills
"15 Seconds of Fame, Inc.","c, sql, nosql, algorithms, debugging, microservices, writing"
A-Line Staffing Solutions,"c, aspnet, sql, leadership, javascript, angular, communication, interpersonal, agile"
A2C,"java, sql, testing, agile, communication, microservices"
ADSANTEC,"hardware, programming, c, agile, devops"
"ALTA IT Services, LLC","agile, java, angular, communication, docker, spring"
AMH,"aspnet, react, nodejs, planning, communication"
ARK InfoTech Spectrum Pvt. Ltd.,"c, java, communication, programming, testing, debugging"
ASSA ABLOY Group,"php, react, css, communication, teamwork, problemsolving, leadership"
AT&T,"agile, testing, programming, javascript, cybersecurity, collaboration, spring, automation, kubernetes, devops"
AVI Foodsystems,"testing, communication, javascript, innovation, angular, css, sql, tensorflow, teamwork"
Ace Hardware Corporation,"hardware, swift, java, communication, collaboration, sql, organization"
Acenda,"communication, leadership, laravel, agile"
Acres,"organization, javascript, agile, testing"
Actalent,"innovation, testing, c, programming, networking, debugging, hardware, writing, devops, rust"
Adept,"react, communication, javascript, empathy, typescript, collaboration"
Aditi Consulting,"spring, java, typescript, agile, docker, sql"
Adobe,"programming, problemsolving, communication, typescript, python, spark, leadership, kafka"
Adyen,"python, sql"
Affirm,"flexibility, initiative, leadership, go, kubernetes, communication, collaboration, planning"
AgileEngine,"devops, programming, sql, nosql, containerization, problemsolving, communication"
Agility,"innovation, agile, collaboration, go, writing, sql, docker"
Agilysys,"agile, java, spring, communication, programming, scripting, docker, kubernetes, testing, nosql"
AgreeYa Solutions,"sql, communication, automation, writing"
Airbnb,"innovation, testing, react, leadership, javascript"
Airswift,debugging
Akamai Technologies,"innovation, programming, virtualization, flexibility"
Akkodis,"programming, flexibility, go, communication, java, css, vue, debugging, devops, problemsolving"
Alarm.com,"hardware, networking, agile, debugging, programming, communication, sql, planning, devops"
Alchemy,"blockchain, java, typescript, python"
Alcon,"go, leadership, hardware, networking, cybersecurity, testing, interpersonal, communication, problemsolving, presentation"
Allstate,"spring, java, testing, agile, planning, programming, writing, leadership, nosql, devops"
Alphatec Spine,"c, communication, testing, programming, presentation, sql, devops, agile, scripting, java"
Altera,"communication, leadership, agile"
Amazon,programming
Amazon Web Services (AWS),"innovation, collaboration, programming, creativity"
AmberBox Gunshot Detection,"planning, agile, hardware"
"American Farm Bureau Insurance Services, Inc. - AFBIS, Inc.","devops, collaboration, automation, innovation, programming, problemsolving, communication"
"American Public Education, Inc. (APEI)","automation, communication, flexibility, decisionmaking, problemsolving, sql, testing, writing"
AmericanAg,"programming, problemsolving, communication, devops, collaboration, automation, innovation, organization, testing, writing"
Ampstek,"programming, c"
Anblicks,"java, react, spring, microservices, angular, problemsolving, communication, leadership, agile"
Anduril Industries,"planning, networking, debugging, testing, communication, initiative, programming, c, rust"
Annapurna,"automation, testing, problemsolving, flexibility, collaboration"
Anomalo,"python, planning, go, debugging, django, flexibility"
Apex Systems,"java, spring, testing, react, agile, angular, programming, leadership, containerization, debugging"
Apothecarie,programming
Appzlogic ,"communication, interpersonal, agile, organization, automation, java"
Aquent,"automation, problemsolving, communication, containerization, docker"
Arcus,"algorithms, docker, initiative"
Argus Labs,"programming, testing, problemsolving, blockchain"
Arkhya Tech. Inc.,"spring, spark, leadership, java, sql, jenkins, nosql, testing, automation, agile"
Arrow Search Partners,"sql, agile, devops, c, docker"
Artisan AI (YC W24),"python, leadership"
Ascendion,"automation, devops, creativity"
Ascendum Solutions,"debugging, scripting, sql, programming, writing"
Ask IT Consulting Inc.,"c, vue"
Aspire Software,"testing, automation, writing, planning, c, typescript, leadership"
Atlas,"testing, php, javascript, programming, c, empathy"
Aurora,"planning, automation, c"
Austin Fraser,"microservices, javascript"
AuxHealth,"python, sql, flexibility"
"AvidXchange, Inc.","agile, automation, communication, debugging, sql, flexibility"
Awardco,"writing, programming"
Axon,"problemsolving, collaboration, c, writing, javascript, empathy, planning, sql, nosql, programming"
"BAE Systems, Inc.","testing, hardware, c, scripting, python, communication, interpersonal, problemsolving, agile, leadership"
BAI,"devops, programming, testing, sql, c, javascript, scripting, teamwork"
BCforward,"programming, python, hardware, collaboration, communication, c"
BSL Consulting,"kafka, python, sql, communication, perl, javascript, problemsolving, agile"
Barrett-Jackson Auction Company,"sql, communication, collaboration, aspnet, java, devops, programming, problemsolving, interpersonal"
Barrington James,"communication, leadership, agile"
Baxter International Inc.,"organization, teamwork, debugging, automation, interpersonal, communication, devops, scripting, flexibility"
Beacon Hill Staffing Group,"java, spring, kafka, agile, nosql, programming, microservices, html, leadership, collaboration"
Benchling,"organization, planning, automation, devops, terraform, kubernetes, microservices, testing, communication"
Berkley Environmental (a Berkley Company),"sql, testing, agile, devops, python"
Bertram Capital,"java, problemsolving, communication"
BetterHelp,"php, bootstrap, sql, go, react, css, javascript, agile, teamwork, hardware"
BigRio,"angular, leadership, sql, testing, innovation, agile, planning, javascript, css, bootstrap"
BioSpace,"testing, collaboration, planning, leadership, typescript, angular, nosql, automation, writing, debugging"
BitGo,"blockchain, testing, microservices, react, docker"
Blackhawk Network,"java, javascript, programming, debugging, testing, jenkins, spring, problemsolving, communication"
Block,"blockchain, go, kotlin, rust, swift, initiative, collaboration, problemsolving, communication, testing"
Bloomberg,"pytorch, machinelearning, leadership, programming, algorithms"
Blue Origin,"leadership, communication, testing, debugging, hardware, agile, planning, algorithms"
"Bluebeam, Inc.","containerization, communication, collaboration"
Blueworks Technologies,"spring, leadership, devops, innovation, testing, microservices, communication, interpersonal, agile"
Boeing,"testing, agile, leadership, hardware, programming, communication, algorithms, c, sql, collaboration"
Booz Allen Hamilton,"agile, testing, microservices, programming, php, sql, scripting, automation, leadership, flexibility"
Box,collaboration
Bracco Medical Technologies,"organization, testing, c, css, jenkins, devops, problemsolving, leadership, react, angular"
Bravens Inc.,"spring, spark, leadership, java, sql, jenkins, nosql, testing, automation, agile"
Braze,"resilience, communication, agile"
BrickRed Systems,"innovation, programming, java, hardware, automation, testing, rust, devops, writing"
BridgeCare,"ruby, javascript, algorithms"
Broadcom,"virtualization, leadership, networking, innovation, java, collaboration, nosql, flexibility, spring, communication"
Brooksource,"leadership, java, organization, react, communication, debugging, agile, cybersecurity, testing, hardware"
Bruker Daltonics,"programming, c, innovation, hardware, collaboration, problemsolving, agile"
ByteDance,"creativity, sql, nosql, testing, javascript, django, writing, problemsolving, programming, hardware"
CACI International Inc,"flexibility, java"
CDK Global,problemsolving
CDW,algorithms
CITGO,"java, microservices, spring, programming, problemsolving, communication, collaboration"
CNA Search,"testing, javascript, writing, sql, aspnet, c, programming, java, php, angular"
COGENT Infotech,"hardware, testing, collaboration, programming, problemsolving, debugging, communication, java"
CSG Talent,"collaboration, innovation, automation, communication, agile"
CSS Tec,"angular, python, nosql"
Calance,"microservices, algorithms, programming"
Cambridge Mobile Telematics,"automation, python, containerization, agile, programming"
Campbell,"testing, programming, sql, interpersonal, communication"
Canoo,"communication, nosql, python, docker, kubernetes, terraform, jenkins"
Capella University,"motivation, writing, debugging, programming, automation, organization, communication"
Capillary Technologies,"nodejs, communication, leadership, express, sql, docker, c, debugging"
Capital One,"agile, programming, nosql, docker, nodejs, go, microservices, typescript, javascript, java"
"Capital Staffing Solutions, Inc.","collaboration, javascript, react, communication, problemsolving, typescript"
CarMax,"innovation, agile, communication, devops, teamwork, sql, nosql, programming, html, css"
"CareMetx, LLC","communication, agile, decisionmaking, creativity, innovation, leadership, kafka, programming, sql, containerization"
Cash App,"collaboration, initiative, communication, blockchain, go, problemsolving"
Caterpillar Inc.,"testing, innovation, programming, agile, planning, java, spark, algorithms, nosql, automation"
Cerebra Consulting Inc,"agile, java, spring, flexibility, microservices, problemsolving, communication, teamwork, initiative, organization"
Certara,"agile, collaboration, leadership, hardware"
Chewy,"communication, innovation, writing, debugging, agile, terraform, testing, leadership, planning, collaboration"
Chick-fil-A Corporate Support Center,"collaboration, devops, programming, agile, interpersonal"
"Cintal, Inc.","testing, hardware, communication, interpersonal"
Cisco,"programming, networking, javascript, planning, python, automation, problemsolving, typescript, vue, go"
Citi,"writing, agile, microservices, spring, presentation, testing"
City Storage Systems,"css, microservices, kubernetes, agile"
Clarivate,"testing, sql"
ClearanceJobs,"devops, innovation, python, javascript, debugging, automation, agile, creativity, programming, testing"
Cloudflare,"programming, rust, writing, debugging, automation, go, communication, javascript, typescript, react"
CodeMonk,"agile, problemsolving, programming, javascript, testing, react, algorithms, python, typescript, java"
Codeliq,"java, spring, sql, problemsolving"
Cohesity,"cybersecurity, agile, debugging, testing"
Coinbase,"testing, presentation"
Collabera,java
Collins Aerospace,"networking, agile, communication, c, debugging"
Comcast,"organization, python, spark, java, programming"
Comcentia,"testing, communication, devops, writing, interpersonal, hardware"
Complete Staffing Solutions,"cybersecurity, python"
Compunnel Inc.,"agile, javascript, sql, docker, automation, python, microservices, writing, problemsolving, communication"
"Comscore, Inc.",communication
Confidential,"agile, writing, c, interpersonal, debugging, hardware, scripting, communication"
Connect-IT ,"python, programming"
Constellation,"testing, sql, programming, agile, debugging, problemsolving, teamwork, nosql, initiative, negotiation"
Conveyor,"algorithms, programming, problemsolving, innovation"
Cookonnect,"ruby, testing, programming, planning, collaboration, agile, communication, writing, flexibility, leadership"
"Core Techs, Inc","react, writing, communication, programming, devops, sql, automation"
Cornelis Networks,"hardware, writing, express, communication, programming, agile"
CornerUp,"leadership, microservices, react, devops, problemsolving"
Corps Team,"problemsolving, communication, agile, sql, devops"
Costco Wholesale,"sql, java, testing, automation, communication, planning, react, problemsolving, javascript"
Cotiviti,"communication, sql, aspnet, programming, java, testing, javascript, microservices, scripting, python"
Covetrus,"javascript, react, programming, java, spring, nodejs, sql, agile"
Cox Automotive Inc.,"agile, organization, ruby, typescript, ansible, creativity, flexibility, innovation, planning"
Crestron Electronics,"algorithms, planning, programming, c, java, networking, scripting, communication, agile"
Crew Capital,"typescript, nodejs, empathy, planning, organization, leadership"
CrowdStrike,"cybersecurity, innovation, flexibility, python, go, java, collaboration, testing, c, writing"
Crunchyroll,"collaboration, testing, html, react"
Crypto Recruiters,"python, communication, problemsolving"
Curinos,"writing, agile, sql, communication, networking, go"
"Curtis Instruments, A Kohler Co.","communication, flexibility, testing, debugging, interpersonal"
Cypress HCM,"scripting, communication"
D. E. Shaw Research,"python, programming, writing"
DAT Freight & Analytics,"kafka, innovation, microservices, sql, nosql, leadership, communication, javascript, docker, react"
DICE (EA Digital Illusions CE AB),"scripting, debugging, express, react, collaboration, programming, writing, communication, creativity"
Daikin Comfort,"testing, programming, communication, algorithms, networking, scripting, debugging, automation"
DataAnnotation,"programming, c, flexibility, writing"
Dataminr,"programming, leadership"
Dataquad Inc.,"java, go, angular, leadership"
Delta Infotek,"scripting, communication, leadership, c, automation, agile"
"Denken Solutions, Inc.","agile, nosql, programming"
Design Pickle,"communication, collaboration, ruby, programming, javascript, react, agile, leadership, spark"
Destiny (D/XYZ),"writing, programming, problemsolving, communication"
Dexian,"agile, testing"
Dexian India,"kafka, spring"
Dice,"communication, problemsolving, spring, programming, testing, java, innovation, agile, sql, writing"
Digital Prospectors,"agile, c, programming, debugging, hardware, scripting"
Digital.ai,"testing, agile, c, communication"
Diverse Lynx,"writing, java, spring, angular, agile, microservices, communication"
Divorce.com,"python, ruby, innovation"
Docusign,"c, programming, testing, nosql, writing, communication, spark, sql, agile, html"
DoorDash,"empathy, go, innovation, initiative"
Drake Software,aspnet
Draper,"innovation, communication"
Dropbox,"debugging, python"
Duetto,"java, javascript, sql, nosql, spring"
"Dynalab, Inc.","flexibility, c, hardware"
E-Solutions,"c, programming"
ECS,"agile, writing, automation, devops, collaboration, interpersonal"
ENGIE Impact,"react, communication, agile, testing, typescript"
EPITEC,"python, agile, docker, communication, listening, programming, react, devops, presentation, java"
EVONA,"c, hardware, testing, communication, writing, kubernetes"
"EXB Solutions, Inc","c, programming"
Early Warning®,"automation, testing, planning, innovation, programming, nodejs, java, networking"
EarnIn,"flexibility, leadership, communication"
Earth Robotics,"communication, sql, programming, php, problemsolving"
Echo Global Logistics,"agile, planning, automation, communication"
Ecolab,"organization, testing, programming, problemsolving, communication, interpersonal, initiative"
Edison Smart,networking
EglobeData,"testing, automation, sql, html, programming, decisionmaking, jenkins, communication, python, writing"
Ehub Global Inc,"aspnet, sql"
"Elegant Enterprise-Wide Solutions, Inc.","communication, agile, networking, testing, programming, algorithms, debugging, hardware"
Eleos Labs,"encryption, agile, planning, devops, sql, testing"
Eliassen Group,"scripting, agile, testing, innovation, programming"
EnerSys,"testing, hardware, scripting, leadership"
Entegee,"flexibility, react, c, testing, nodejs, javascript, css, html"
Epiroc,"testing, communication, innovation"
Equifax,"microservices, agile, jenkins, terraform, css, angular, sql, communication, leadership, presentation"
Equity Residential,"writing, organization, collaboration, programming, sql, devops, communication"
Esri,"c, algorithms, communication"
"Everest Consultants, Inc.","testing, nosql, java, react"
Evinova,"spring, devops, nosql, angular, typescript, problemsolving"
Exact Sciences,"creativity, testing, sql"
Exarca Inc.,"java, scripting, python"
Execufy,"programming, leadership, initiative, innovation, agile, communication, interpersonal, networking"
Experis,"agile, programming, testing, scripting, communication, writing, problemsolving, angular, sql, nosql"
FIS,"testing, communication, agile, collaboration, innovation, debugging, typescript, automation, sql, devops"
"FUJIFILM Sonosite, Inc.","communication, debugging, c, innovation, go, hardware, programming, writing, ruby"
FUSTIS LLC,"python, microservices, programming"
FYI Solutions,"java, communication, agile, programming, teamwork, leadership, innovation, javascript, nodejs, collaboration"
FanDuel,"testing, java, terraform, writing, programming, devops, innovation, hardware, react, agile"
Fanatics,"organization, leadership, programming, c, nosql, problemsolving, testing, automation, agile"
FastTek Global,"agile, go, testing, communication, sql, interpersonal"
Favor Delivery,"communication, planning, algorithms, go"
Fetch,"planning, swift, testing, hardware"
Fidelity Investments,"go, agile, organization, java, programming, testing, automation, collaboration, leadership, angular"
Fifth Third Bank,"leadership, agile, sql, spring, networking, problemsolving"
First Cloud Inc,java
FiscalNote,"leadership, python, collaboration, decisionmaking, writing, flexibility"
Fivetran,"sql, react, kubernetes, debugging, leadership, programming, java"
Flaunt,"writing, typescript, nextjs, communication, collaboration, innovation"
Flexton Inc.,"algorithms, spark"
FloQast,"listening, automation, collaboration"
Ford Motor Company,"agile, communication, spring, programming, java, testing, problemsolving, sql, teamwork, automation"
Formation Bio,"innovation, collaboration, communication"
Foundation Model Startup,devops
Frankenmuth Insurance,leadership
Freddie Mac,"c, testing, programming, collaboration, python"
Frontall USA,hardware
FrostyWhale,java
Fruition IT,"agile, automation, programming, terraform"
Fullsteam,"testing, communication, hardware, problemsolving, react, sql, decisionmaking, networking, programming, debugging"
Fullstory,"writing, kubernetes, listening, flexibility"
Function Health,"leadership, innovation, collaboration, problemsolving, containerization, react, programming, agile, python, initiative"
GE Aerospace,"planning, communication, hardware"
GE HealthCare,"agile, leadership, testing, communication, organization, writing, algorithms, planning, c, java"
GHX,"typescript, javascript, testing, agile, flexibility, automation"
GOYT,"php, decisionmaking, programming, communication, collaboration, innovation"
GRAIL,"testing, automation, writing, debugging, python, agile, listening, communication"
Galactic Minds INC,"c, programming"
Garmin,"devops, automation, testing, python, scripting, jenkins, virtualization, ansible, c"
Gem,organization
Gemini,"collaboration, devops"
General Dynamics Mission Systems,"agile, c, testing, java, cybersecurity, python, docker, containerization, problemsolving, networking"
General Motors,"flexibility, programming, organization, communication, problemsolving, leadership, testing, kubernetes, writing, presentation"
Genesys,"collaboration, microservices, automation, testing, empathy, nosql, nodejs"
Genisis Technology Solutions,"devops, docker, react, spring, agile"
Genius Sports,"writing, innovation, planning, communication, programming, organization"
Georgia Tech Research Institute,"hardware, programming, problemsolving, algorithms, organization, leadership, communication, testing, debugging"
GfK - An NIQ Company,"spring, agile, java, interpersonal, testing, leadership, angular, sql, communication, devops"
GitHub,"communication, leadership, programming, ruby, organization"
Goldman Lloyds,java
Goldman Sachs,"programming, leadership, innovation, spring, kubernetes, planning, problemsolving, communication, python, kafka"
Goliath Partners,"python, c, algorithms"
Google,"leadership, networking, hardware, programming, organization, algorithms, java, sql, python, planning"
Goosehead Insurance Agency,"nodejs, react, initiative, decisionmaking, interpersonal, communication, problemsolving"
GraceMark Solutions,"programming, microservices, kubernetes, testing, kafka"
Grammarly,"collaboration, writing, algorithms, java, debugging, react, typescript, javascript, testing, programming"
Gridavate,"agile, planning, problemsolving, go, c, communication, teamwork"
"Griffin Global Systems, Inc.","hardware, c, communication"
"Groundswell, Inc.","resilience, initiative, planning, collaboration, teamwork, communication"
H-E-B,"leadership, communication, java, agile"
H10 Capital,"hardware, programming, python, communication, debugging, automation, testing"
HIRECLOUT,"agile, sql, writing, testing, problemsolving, communication, programming, nodejs, css, bootstrap"
HTC Global Services,"communication, problemsolving, nosql, agile, java, spring, collaboration, automation, debugging, programming"
"HTI Cybernetics, Inc.","automation, programming"
"Hanker Systems, Inc.","programming, python, hardware, communication"
Harness,"innovation, devops, html, docker, testing, css, leadership, debugging, nodejs"
Harvey Nash,"programming, encryption, communication"
Hearth AI,"algorithms, innovation, typescript"
Hedgehog,"networking, programming, testing, kubernetes, debugging"
Helix Tech IT Services,"programming, communication, collaboration"
Heritage Grocers Group,"testing, sql, agile, problemsolving"
Higher Ground LLC,"programming, agile, django, docker"
Highwire,"agile, java, c, php, go"
Hire Quality Recruiting,"java, flexibility"
Hirexa Solutions,"agile, spring, java, kubernetes, sql, writing, terraform, initiative"
Honeycomb Software,"sql, javascript, problemsolving, communication, collaboration, decisionmaking"
Honeywell,"communication, innovation, algorithms, organization, interpersonal, leadership, hardware, decisionmaking, agile, collaboration"
Horizontal Talent,java
HubSpot,"nodejs, django, organization"
Huntress,"php, agile, laravel, cybersecurity, programming, writing"
HyperThinkUS,"c, networking, programming, problemsolving, communication, collaboration"
Hyqoo ,"kubernetes, communication, programming, go, problemsolving, teamwork"
Hyster-Yale Group,"testing, leadership, programming, hardware"
ICE,"programming, python, spark, nosql, communication, flexibility"
"IDR, Inc.","organization, agile, programming, jenkins, devops, communication, sql, python, react"
IGT,"c, sql, communication, problemsolving, programming, innovation"
INFY8,"programming, sql"
ITR Group,"c, sql, agile, debugging, devops"
"ITS, LLC","c, programming, testing, leadership, problemsolving, communication, teamwork"
ITW,"communication, c, hardware, testing, debugging, innovation"
"Ideal Innovations, Inc.","hardware, testing"
InRhythm,"innovation, express, agile, testing, communication, javascript, go, programming, automation"
Incident IQ,"c, writing, aspnet, testing, sql, programming, devops, debugging, problemsolving"
Included Health,"collaboration, leadership, organization, agile, devops, automation, problemsolving, nosql"
Info Way Solutions,"c, debugging, cybersecurity, testing, innovation, writing, sql, programming"
Infobahn Softworld Inc,"programming, debugging"
Insight Global,"programming, testing, sql, docker, hadoop, hardware, c, communication, java, spring"
Integra Connect,"programming, testing, sql"
Internet2,"automation, testing, networking, leadership, planning, python, programming, organization"
Intuitive,"collaboration, testing, problemsolving, sql, communication"
Invisinet Technologies,"testing, leadership, collaboration, programming, networking, agile"
"J.B. Hunt Transport Services, Inc.","agile, testing, programming, communication, java, c, html, angular, sql, nosql"
JAM Staffing,"agile, programming"
JPMorgan Chase & Co.,"agile, programming, algorithms, java, spring, automation, sql, testing, spark, innovation"
Jack in the Box,"agile, writing, testing, programming, leadership"
Jacobs,"programming, writing, java, presentation, spring, javascript, perl"
Jobot,"testing, go, agile, kubernetes, spark, docker, typescript, problemsolving, communication, c"
Jobs via eFinancialCareers,"c, algorithms, python, innovation"
Joby Aviation,"hardware, c, writing, communication, python"
John Galt Staffing,java
"KBR, Inc.","communication, devops, organization, programming, kubernetes, flexibility, hardware, cybersecurity, resilience, java"
KPG99 INC,"sql, java, communication"
KPIT,"programming, communication, problemsolving"
KYYBA Inc,"programming, testing, python, c"
Kapitus,"agile, testing, microservices, python, nosql, communication, interpersonal, problemsolving, motivation"
KellyMitchell Group,"angular, testing, debugging, agile"
Kiewit,"planning, programming, sql, problemsolving, communication"
Kin Insurance,"decisionmaking, leadership, organization"
Kinetic,"python, automation, testing, django, nosql, problemsolving, communication"
Kinetix,"leadership, agile, hardware, microservices, scripting, sql, programming"
Koddi,"leadership, organization, communication, interpersonal, problemsolving"
LTK,"agile, writing, java, containerization, docker, communication"
Lacework,"algorithms, innovation, communication, python, nosql"
Lakera,"devops, python"
Ledgent Technology,"initiative, programming, automation, testing, c, networking, problemsolving, interpersonal, communication, kubernetes"
Leidos,"agile, testing, devops, java, programming, scripting, algorithms, sql, nosql, leadership"
LemaTech LLC,"programming, problemsolving, communication, teamwork"
LexisNexis Risk Solutions,"testing, communication, flexibility, react"
Liberty Mutual Insurance,"agile, devops, python, adaptability, programming"
